### ISSUE TITLE
bug: Connectivity issues on a real-like deployement

### ISSUE THREAD

**Issue by dpc** [n0-computer/iroh#3243]
**Describe the bug**

We're working on Iroh connectivity in https://github.com/fedimint/fedimint .

Recently we've set up a test federation (4 nodes connecting to each other), and while everything was mostly working, the logs were full of the messages below, which I was told actually indicate something being wrong.

This setup was done on 4 different desktops, probably all behind NAT, etc. on different continents. 

If it is of any help, here is how we set up p2p and api communication on the peers (servers) in a federation: https://github.com/fedimint/fedimint/blob/664955411fc1c3fd266fcaf2a9d2bd708f929736/fedimint-server/src/net/p2p_connector.rs#L270

And here is how clients setup their connectvity: https://github.com/fedimint/fedimint/blob/664955411fc1c3fd266fcaf2a9d2bd708f929736/fedimint-api-client/src/api/mod.rs#L1239

**Relevant Logs**

Unfortunately we were doing it without debug logs enabled for Iroh, and it might takes us some time to re-attempt this, so I can only paste here what I got and it was flood of these type of warnings

```
fedimintd-1  | 2025-03-19T18:43:52.832017Z  WARN ep{me=a555864de0}:magicsock:poll_recv:disco_in{node=60a79b3dfd src=Udp(127.0.0.1:46349)}: iroh::magicsock: failed to open disco box err=Aead(Error)
fedimintd-1  | 2025-03-19T18:43:52.836309Z  WARN ep{me=a555864de0}:magicsock:poll_recv: iroh::magicsock: UDP recv quic packets: no node state found, skipping src=127.0.0.1:58277 count=1 len=33
fedimintd-1  | 2025-03-19T18:43:52.853492Z  WARN ep{me=061de26be4}:magicsock:poll_recv:disco_in{node=061de26be4 src=Udp(127.0.0.1:8173)}: iroh::magicsock: failed to open disco box err=Aead(Error)
fedimintd-1  | 2025-03-19T18:43:52.859659Z  WARN ep{me=061de26be4}:magicsock:poll_recv:disco_in{node=061de26be4 src=Udp(127.0.0.1:8173)}: iroh::magicsock: failed to open disco box err=Aead(Error)
fedimintd-1  | 2025-03-19T18:43:52.927804Z  WARN ep{me=a555864de0}:magicsock:poll_recv:disco_in{node=78ee721764 src=Udp(127.0.0.1:32928)}: iroh::magicsock: failed to open disco box err=Aead(Error)
fedimintd-1  | 2025-03-19T18:43:53.451717Z  WARN ep{me=a555864de0}:magicsock:poll_recv: iroh::magicsock: UDP recv quic packets: no node state found, skipping src=127.0.0.1:58277 count=1 len=30
fedimintd-1  | 2025-03-19T18:43:53.602467Z  WARN ep{me=a555864de0}:magicsock:poll_recv: iroh::magicsock: UDP recv quic packets: no node state found, skipping src=127.0.0.1:58277 count=1 len=33
fedimintd-1  | 2025-03-19T18:43:53.837036Z  WARN ep{me=a555864de0}:magicsock:poll_recv: iroh::magicsock: UDP recv quic packets: no node state found, skipping src=127.0.0.1:58277 count=1 len=30
fedimintd-1  | 2025-03-19T18:43:54.002176Z  WARN ep{me=a555864de0}:magicsock:poll_recv: iroh::magicsock: UDP recv quic packets: no node state fedimintd-1  | 2025-03-19T18:44:01.397847Z  WARN ep{me=a555864de0}:magicsock:poll_recv: iroh::magicsock: UDP recv quic packets: no node state found
, skipping src=127.0.0.1:58277 count=1 len=33
fedimintd-1  | 2025-03-19T18:44:01.446658Z  WARN ep{me=a555864de0}:magicsock:net_report.actor:reportgen.actor:probe: iroh_net_report::reportgen: pr
obe failed: Failed to send STUN request: StunIpv4: Invalid argument (os error 22) probe=StunIpv4 { delay: 263.995677ms, node: RelayNode { url: Rela
yUrl("https://euw1-1.relay.iroh.network./"), stun_only: false, stun_port: 3478, quic: Some(RelayQuicConfig { port: 7842 }) } }
fedimintd-1  | 2025-03-19T18:44:01.446667Z  WARN ep{me=a555864de0}:magicsock:net_report.actor:reportgen.actor:probe: iroh_net_report::reportgen: no
 successful probes in ProbeSet probe_proto=Some(StunIpv4)found, skipping src=127.0.0.1:58277 count=1 len=33
fedimintd-1  | 2025-03-19T18:43:54.603292Z  WARN ep{me=a555864de0}:magicsock:poll_recv: iroh::magicsock: UDP recv quic packets: no node state found, skipping src=127.0.0.1:58277 count=1 len=30
fedimintd-1  | 2025-03-19T18:43:54.963190Z  WARN ep{me=a555864de0}:magicsock:poll_recv: iroh::magicsock: UDP recv quic packets: no node state found, skipping src=127.0.0.1:58277 count=1 len=33
fedimintd-1  | 2025-03-19T18:43:55.078428Z  WARN ep{me=a555864de0}:magicsock:poll_recv: iroh::magicsock: UDP recv quic packets: no node state found, skipping src=127.0.0.1:58277 count=1 len=33
fedimintd-1  | 2025-03-19T18:43:55.083577Z  WARN ep{me=a555864de0}:magicsock:poll_recv: iroh::magicsock: UDP recv quic packets: no node state found, skipping src=127.0.0.1:58277 count=1 len=30
fedimintd-1  | 2025-03-19T18:43:55.187929Z  WARN ep{me=a555864de0}:magicsock:poll_recv: iroh::magicsock: UDP recv quic packets: no node state found, skipping src=127.0.0.1:58277 count=1 len=33
fedimintd-1  | 2025-03-19T18:43:55.381140Z  WARN ep{me=a555864de0}:magicsock:poll_recv:disco_in{node=60a79b3dfd src=Udp(127.0.0.1:46349)}: iroh::magicsock: failed to open disco box err=Aead(Error)
fedimintd-1  | 2025-03-19T18:43:55.488920Z  WARN ep{me=a555864de0}:magicsock:poll_recv:disco_in{node=e783f3c321 src=Udp(127.0.0.1:58277)}: iroh::magicsock: failed to open disco box err=Aead(Error)
fedimintd-1  | 2025-03-19T18:43:55.488945Z  WARN ep{me=a555864de0}:magicsock:poll_recv:disco_in{node=e783f3c321 src=Udp(127.0.0.1:58277)}: iroh::magicsock: failed to open disco box err=Aead(Error)
fedimintd-1  | 2025-03-19T18:43:55.720099Z  WARN ep{me=061de26be4}:magicsock:poll_recv:disco_in{node=061de26be4 src=Udp(127.0.0.1:8173)}: iroh::magicsock: failed to open disco box err=Aead(Error)
fedimintd-1  | 2025-03-19T18:43:55.964207Z  WARN ep{me=a555864de0}:magicsock:poll_recv: iroh::magicsock: UDP recv quic packets: no node state found, skipping src=127.0.0.1:58277 count=1 len=30
fedimintd-1  | 2025-03-19T18:43:56.272037Z  WARN ep{me=a555864de0}:magicsock:poll_recv: iroh::magicsock: UDP recv quic packets: no node state found, skipping src=127.0.0.1:58277 count=1 len=30
fedimintd-1  | 2025-03-19T18:43:56.288845Z  WARN ep{me=a555864de0}:magicsock:poll_recv: iroh::magicsock: UDP recv quic packets: no node state found, skipping src=127.0.0.1:58277 count=1 len=30
fedimintd-1  | 2025-03-19T18:43:56.326980Z  WARN ep{me=a555864de0}:magicsock:poll_recv:disco_in{node=78ee721764 src=Udp(127.0.0.1:32928)}: iroh::magicsock: failed to open disco box err=Aead(Error)
fedimintd-1  | 2025-03-19T18:43:56.327005Z  WARN ep{me=a555864de0}:magicsock:poll_recv:disco_in{node=78ee721764 src=Udp(127.0.0.1:32928)}: iroh::magicsock: failed to open disco box err=Aead(Error)
fedimintd-1  | 2025-03-19T18:43:56.402025Z  WARN ep{me=a555864de0}:magicsock:poll_recv: iroh::magicsock: UDP recv quic packets: no node state found, skipping src=127.0.0.1:58277 count=1 len=33
fedimintd-1  | 2025-03-19T18:43:56.733293Z  WARN ep{me=a555864de0}:magicsock:poll_recv: iroh::magicsock: UDP recv quic packets: no node state found, skipping src=127.0.0.1:58277 count=1 len=33
fedimintd-1  | 2025-03-19T18:43:56.919002Z  WARN ep{me=a555864de0}:magicsock:poll_recv:disco_in{node=60a79b3dfd src=Udp(127.0.0.1:46349)}: iroh::magicsock: failed to open disco box err=Aead(Error)
fedimintd-1  | 2025-03-19T18:43:56.919057Z  WARN ep{me=a555864de0}:magicsock:poll_recv:disco_in{node=78ee721764 src=Udp(127.0.0.1:32928)}: iroh::magicsock: failed to open disco box err=Aead(Error)
fedimintd-1  | 2025-03-19T18:43:56.937076Z  WARN ep{me=a555864de0}:magicsock:poll_recv:disco_in{node=60a79b3dfd src=Udp(127.0.0.1:46349)}: iroh::magicsock: failed to open disco box err=Aead(Error)
fedimintd-1  | 2025-03-19T18:43:56.937094Z  WARN ep{me=a555864de0}:magicsock:poll_recv:disco_in{node=e783f3c321 src=Udp(127.0.0.1:58277)}: iroh::magicsock: failed to open disco box err=Aead(Error)
fedimintd-1  | 2025-03-19T18:43:57.017430Z  WARN ep{me=a555864de0}:magicsock:poll_recv:disco_in{node=78ee721764 src=Udp(127.0.0.1:32928)}: iroh::magicsock: failed to open disco box err=Aead(Error)
fedimintd-1  | 2025-03-19T18:43:57.132353Z  WARN ep{me=a555864de0}:magicsock:poll_recv:disco_in{node=e783f3c321 src=Udp(127.0.0.1:58277)}: iroh::magicsock: failed to open disco box err=Aead(Error)
fedimintd-1  | 2025-03-19T18:43:57.454032Z  WARN ep{me=a555864de0}:magicsock:poll_recv: iroh::magicsock: UDP recv quic packets: no node state found, skipping src=127.0.0.1:58277 count=1 len=30
fedimintd-1  | 2025-03-19T18:43:57.478243Z  WARN ep{me=a555864de0}:magicsock:poll_recv: iroh::magicsock: UDP recv quic packets: no node state found, skipping src=127.0.0.1:58277 count=1 len=30
fedimintd-1  | 2025-03-19T18:43:57.508492Z  WARN ep{me=a555864de0}:magicsock:poll_recv: iroh::magicsock: UDP recv quic packets: no node state found, skipping src=127.0.0.1:58277 count=1 len=33
fedimintd-1  | 2025-03-19T18:43:57.589157Z  WARN ep{me=a555864de0}:magicsock:poll_recv: iroh::magicsock: UDP recv quic packets: no node state found, skipping src=127.0.0.1:58277 count=1 len=33
fedimintd-1  | 2025-03-19T18:43:57.624948Z  WARN ep{me=061de26be4}:magicsock:poll_recv:disco_in{node=061de26be4 src=Udp(127.0.0.1:8173)}: iroh::magicsock: failed to open disco box err=Aead(Error)
fedimintd-1  | 2025-03-19T18:43:57.743599Z  WARN ep{me=a555864de0}:magicsock:poll_recv:disco_in{node=e783f3c321 src=Udp(127.0.0.1:58277)}: iroh::magicsock: failed to open disco box err=Aead(Error)
fedimintd-1  | 2025-03-19T18:43:57.746267Z  WARN ep{me=a555864de0}:magicsock:poll_recv:disco_in{node=60a79b3dfd src=Udp(127.0.0.1:46349)}: iroh::magicsock: failed to open disco box err=Aead(Error)
fedimintd-1  | 2025-03-19T18:43:57.850007Z  WARN ep{me=061de26be4}:magicsock:poll_recv:disco_in{node=061de26be4 src=Udp(127.0.0.1:8173)}: iroh::magicsock: failed to open disco box err=Aead(Error)
fedimintd-1  | 2025-03-19T18:43:57.855586Z  WARN ep{me=061de26be4}:magicsock:poll_recv:disco_in{node=061de26be4 src=Udp(127.0.0.1:8173)}: iroh::magicsock: failed to open disco box err=Aead(Error)
fedimintd-1  | 2025-03-19T18:43:57.899798Z  WARN ep{me=a555864de0}:magicsock:poll_recv: iroh::magicsock: UDP recv quic packets: no node state found, skipping src=127.0.0.1:58277 count=1 len=30
fedimintd-1  | 2025-03-19T18:43:57.930583Z  WARN ep{me=a555864de0}:magicsock:poll_recv:disco_in{node=78ee721764 src=Udp(127.0.0.1:32928)}: iroh::magicsock: failed to open disco box err=Aead(Error)
fedimintd-1  | 2025-03-19T18:43:58.373650Z  WARN ep{me=a555864de0}:magicsock:poll_recv: iroh::magicsock: UDP recv quic packets: no node state found, skipping src=127.0.0.1:58277 count=1 len=33
fedimintd-1  | 2025-03-19T18:43:58.642343Z  WARN ep{me=a555864de0}:magicsock:poll_recv: iroh::magicsock: UDP recv quic packets: no node state found, skipping src=127.0.0.1:58277 count=1 len=30
fedimintd-1  | 2025-03-19T18:43:58.754359Z  WARN ep{me=061de26be4}:magicsock:net_report.actor:reportgen.actor:probe: iroh_net_report::reportgen: probe failed: Failed to send STUN request: StunIpv4: Invalid argument (os error 22) probe=StunIpv4 { delay: 0ns, node: RelayNode { url: RelayUrl("https://use1-1.relay.iroh.network./"), stun_only: false, stun_port: 3478, quic: Some(RelayQuicConfig { port: 7842 }) } }
fedimintd-1  | 2025-03-19T18:43:58.754399Z  WARN ep{me=061de26be4}:magicsock:net_report.actor:reportgen.actor:probe: iroh_net_report::reportgen: probe failed: Failed to send STUN request: StunIpv4: Invalid argument (os error 22) probe=StunIpv4 { delay: 0ns, node: RelayNode { url: RelayUrl("https://euw1-1.relay.iroh.network./"), stun_only: false, stun_port: 3478, quic: Some(RelayQuicConfig { port: 7842 }) } }
fedimintd-1  | 2025-03-19T18:43:58.754548Z  WARN ep{me=061de26be4}:magicsock:net_report.actor:reportgen.actor:probe: iroh_net_report::reportgen: probe failed: Failed to send STUN request: StunIpv4: Invalid argument (os error 22) probe=StunIpv4 { delay: 0ns, node: RelayNode { url: RelayUrl("https://aps1-1.relay.iroh.network./"), stun_only: false, stun_port: 3478, quic: Some(RelayQuicConfig { port: 7842 }) } }
fedimintd-1  | 2025-03-19T18:43:58.754575Z  WARN ep{me=061de26be4}:magicsock:net_report.actor:reportgen.actor:probe: iroh_net_report::reportgen: no successful probes in ProbeSet probe_proto=Some(StunIpv4)
fedimintd-1  | 2025-03-19T18:43:58.799523Z  WARN ep{me=a555864de0}:magicsock:poll_recv: iroh::magicsock: UDP recv quic packets: no node state found, skipping src=127.0.0.1:58277 count=1 len=33
fedimintd-1  | 2025-03-19T18:43:58.895257Z  WARN ep{me=061de26be4}:magicsock:net_report.actor:reportgen.actor:probe: iroh_net_report::reportgen: probe failed: Failed to send STUN request: StunIpv4: Invalid argument (os error 22) probe=StunIpv4 { delay: 139.696962ms, node: RelayNode { url: RelayUrl("https://use1-1.relay.iroh.network./"), stun_only: false, stun_port: 3478, quic: Some(RelayQuicConfig { port: 7842 }) } }
fedimintd-1  | 2025-03-19T18:43:58.928392Z  WARN ep{me=a555864de0}:magicsock:poll_recv: iroh::magicsock: UDP recv quic packets: no node state found, skipping src=127.0.0.1:58277 count=1 len=30
fedimintd-1  | 2025-03-19T18:43:59.023183Z  WARN ep{me=061de26be4}:magicsock:net_report.actor:reportgen.actor:probe: iroh_net_report::reportgen: probe failed: Failed to send STUN request: StunIpv4: Invalid argument (os error 22) probe=StunIpv4 { delay: 267.406858ms, node: RelayNode { url: RelayUrl("https://euw1-1.relay.iroh.network./"), stun_only: false, stun_port: 3478, quic: Some(RelayQuicConfig { port: 7842 }) } }
fedimintd-1  | 2025-03-19T18:43:59.023195Z  WARN ep{me=061de26be4}:magicsock:net_report.actor:reportgen.actor:probe: iroh_net_report::reportgen: no successful probes in ProbeSet probe_proto=Some(StunIpv4)
fedimintd-1  | 2025-03-19T18:43:59.035212Z  WARN ep{me=061de26be4}:magicsock:net_report.actor:reportgen.actor:probe: iroh_net_report::reportgen: probe failed: Failed to send STUN request: StunIpv4: Invalid argument (os error 22) probe=StunIpv4 { delay: 279.393924ms, node: RelayNode { url: RelayUrl("https://use1-1.relay.iroh.network./"), stun_only: false, stun_port: 3478, quic: Some(RelayQuicConfig { port: 7842 }) } }
fedimintd-1  | 2025-03-19T18:43:59.129913Z  WARN ep{me=a555864de0}:magicsock:poll_recv: iroh::magicsock: UDP recv quic packets: no node state found, skipping src=127.0.0.1:58277 count=1 len=33
fedimintd-1  | 2025-03-19T18:43:59.174781Z  WARN ep{me=061de26be4}:magicsock:net_report.actor:reportgen.actor:probe: iroh_net_report::reportgen: probe failed: Failed to send STUN request: StunIpv4: Invalid argument (os error 22) probe=StunIpv4 { delay: 419.090886ms, node: RelayNode { url: RelayUrl("https://use1-1.relay.iroh.network./"), stun_only: false, stun_port: 3478, quic: Some(RelayQuicConfig { port: 7842 }) } }
fedimintd-1  | 2025-03-19T18:43:59.174793Z  WARN ep{me=061de26be4}:magicsock:net_report.actor:reportgen.actor:probe: iroh_net_report::reportgen: no successful probes in ProbeSet probe_proto=Some(StunIpv4)
fedimintd-1  | 2025-03-19T18:43:59.489059Z  WARN try_send: iroh_quinn_udp: sendmsg error: Os { code: 22, kind: InvalidInput, message: "Invalid argument" }, Transmit: { destination: 129.222.145.55:40845, src_ip: Some(::), ecn: None, len: 33, segment_size: None }
fedimintd-1  | 2025-03-19T18:43:59.542438Z  WARN ep{me=a555864de0}:magicsock:poll_recv: iroh::magicsock: UDP recv quic packets: no node state found, skipping src=127.0.0.1:58277 count=1 len=30
fedimintd-1  | 2025-03-19T18:43:59.858511Z  WARN ep{me=a555864de0}:magicsock:poll_recv: iroh::magicsock: UDP recv quic packets: no node state found, skipping src=127.0.0.1:58277 count=1 len=30
fedimintd-1  | 2025-03-19T18:43:59.954941Z  WARN ep{me=a555864de0}:magicsock:poll_recv: iroh::magicsock: UDP recv quic packets: no node state found, skipping src=127.0.0.1:58277 count=1 len=33
fedimintd-1  | 2025-03-19T18:43:59.959271Z  WARN ep{me=a555864de0}:magicsock:poll_recv: iroh::magicsock: UDP recv quic packets: no node state found, skipping src=127.0.0.1:58277 count=1 len=33
fedimintd-1  | 2025-03-19T18:44:00.380727Z  WARN ep{me=a555864de0}:magicsock:poll_recv:disco_in{node=60a79b3dfd src=Udp(127.0.0.1:46349)}: iroh::magicsock: failed to open disco box err=Aead(Error)
fedimintd-1  | 2025-03-19T18:44:00.380784Z  WARN ep{me=a555864de0}:magicsock:poll_recv:disco_in{node=60a79b3dfd src=Udp(127.0.0.1:46349)}: iroh::magicsock: failed to open disco box err=Aead(Error)
fedimintd-1  | 2025-03-19T18:44:00.488642Z  WARN ep{me=a555864de0}:magicsock:poll_recv:disco_in{node=e783f3c321 src=Udp(127.0.0.1:58277)}: iroh::magicsock: failed to open disco box err=Aead(Error)
fedimintd-1  | 2025-03-19T18:44:00.503963Z  WARN ep{me=a555864de0}:magicsock:poll_recv: iroh::magicsock: UDP recv quic packets: no node state found, skipping src=127.0.0.1:58277 count=1 len=30
fedimintd-1  | 2025-03-19T18:44:00.720010Z  WARN ep{me=061de26be4}:magicsock:poll_recv:disco_in{node=061de26be4 src=Udp(127.0.0.1:8173)}: iroh::magicsock: failed to open disco box err=Aead(Error)
fedimintd-1  | 2025-03-19T18:44:00.720032Z  WARN ep{me=061de26be4}:magicsock:poll_recv:disco_in{node=061de26be4 src=Udp(127.0.0.1:8173)}: iroh::magicsock: failed to open disco box err=Aead(Error)
fedimintd-1  | 2025-03-19T18:44:00.740671Z  WARN ep{me=a555864de0}:magicsock:poll_recv: iroh::magicsock: UDP recv quic packets: no node state found,
```

**Expected behavior**
No warnings?

**Platform(s)**
3 Linux boxes, one MacOS

**Comment by flub** [comment]
Which machine is this log fragment from?  The Linux ones or the MacOS?  Is it a "computer" or a "mobile".  Did the device sleep between iroh starting and this log framgment?

**Comment by dpc** [comment]
That's from my NixOS machine in California. It's a desktop computer, no sleeps.

**Comment by dpc** [comment]
OK, so another round, documenting my findings.

I have 4 boxes, and communication between them seem to be working. Each of them has two iroh endpoints. Here are their endpoint ids.

host1:

```
fedimintd-1  | 2025-03-25T21:06:53.841580Z  INFO fm::net::iroh: Iroh p2p server endpoint bind_addr=0.0.0.0:8173 node_id=aaeeb4dfb498279f0133139bb0a
353654f1e1cf946b89169a1bb45faee8c9cda node_id_pkarr=imzmjz7wuyu36yjunqp5be4uci8th883e4hjn4pbzpn9i5wcuupy

fedimintd-1  | 2025-03-25T21:07:31.662668Z  INFO fm::net::iroh: Iroh api server endpoint bind_addr=0.0.0.0:8174 node_id=02b251fed03d0c4332271525a69
b112e29a324b427e84de997de8fdbd6a2889b node_id_pkarr=yk3fd9so8wgrgct8nw14pgatfaw4gjfwr9wr54cz5487ziintnpo
```


host2:

```
fedimintd-1  | 2025-03-25T21:06:55.053154Z  INFO fm::net::iroh: Iroh p2p server endpoint bind_addr=0.0.0.0:8173 node_id=1c81f76de76d77fc611030b3ff9
dc24c627f16a8b8a2c4100814d2c602538477 node_id_pkarr=d1y9q5x8pi59aaeogn3998qnjtt86fiezntceryenujccy1uot5o

fedimintd-1  | 2025-03-25T21:07:31.863107Z  INFO fm::net::iroh: Iroh api server endpoint bind_addr=0.0.0.0:8174 node_id=7c65ca85dee0dc4cf45b747631d
23c1f1639a4f94d6b1986eb391f257fe2ee38 node_id_pkarr=xt1hibq6hdqr37n5qt5ddwthdhmduj83jiitubzm8rx1k99n7ahy
```


docker-1:

```
fedimintd-1  | 2025-03-25T21:06:51.471127Z  INFO fm::net::iroh: Iroh p2p server endpoint bind_addr=0.0.0.0:8173 node_id=dd48b3eab2c134a16a733151f0a
a7dcc3b9a3ba304672cb272517adc85e645c6 node_id_pkarr=5irm84i1ar4kn4uugfe9bku73o73wq7dytu13cu1kf7p3bxgezdy


fedimintd-1  | 2025-03-25T21:07:33.009359Z  INFO fm::net::iroh: Iroh api server endpoint bind_addr=0.0.0.0:8174 node_id=2dacefab5296cbfe0d822aa8d5c
9988e15457ff603fd31c75a13d4fb6f6041af node_id_pkarr=fssq9k4115f9hdcnfkwpm1catakwk99syx6udt44nxkxs55yegzo
```


docker-2:

```
fedimintd-1  | 2025-03-25T21:06:49.825982Z  INFO fm::net::iroh: Iroh p2p server endpoint bind_addr=0.0.0.0:8173 node_id=fbdfc8ab3df30f76293cec1e12a
6e5e31ad77f8459cc70f103c6d68e130d6fe4 node_id_pkarr=9xxhtk376c8zckjh7oxbfjzfhcppq9hrm8g8bheda5mehrapp91y

fedimintd-1  | 2025-03-25T21:07:32.955985Z  INFO fm::net::iroh: Iroh api server endpoint bind_addr=0.0.0.0:8174 node_id=f549ea9d12f5c931043a4220c57
5d6477e7219f512a39c72a2570713fe213ae4 node_id_pkarr=6ir6i8e16zrunbb4eeock7qse798rgxinkt3ahinkhdt89tb8m1ynnn
```


If we look at the logs of host-1:

```

fedimintd-1  | 2025-03-25T21:35:06.010317Z  WARN ep{me=02b251fed0}:magicsock:poll_recv:disco_in{node=cd3f24e40f src=Udp(172.25.0.11:58893)}: iroh::magicsock: failed to open disco box err=Aead(Error)
fedimintd-1  | 2025-03-25T21:35:06.665779Z  WARN ep{me=02b251fed0}:magicsock:poll_recv:disco_in{node=60e5463231 src=Udp(172.25.0.11:39585)}: iroh::magicsock: failed to open disco box err=Aead(Error)
fedimintd-1  | 2025-03-25T21:35:06.689954Z  WARN ep{me=02b251fed0}:magicsock:poll_recv:disco_in{node=60e5463231 src=Udp(172.25.0.11:39585)}: iroh::magicsock: failed to open disco box err=Aead(Error)
fedimintd-1  | 2025-03-25T21:35:06.745378Z  WARN ep{me=02b251fed0}:magicsock:poll_recv:disco_in{node=cd3f24e40f src=Udp(172.25.0.11:58893)}: iroh::magicsock: failed to open disco box err=Aead(Error)
fedimintd-1  | 2025-03-25T21:35:06.764594Z  WARN ep{me=02b251fed0}:magicsock:poll_recv:disco_in{node=c8af7c74f1 src=Udp(172.25.0.11:40494)}: iroh::magicsock: failed to open disco box err=Aead(Error)
fedimintd-1  | 2025-03-25T21:35:08.639083Z  WARN ep{me=aaeeb4dfb4}:magicsock:poll_recv:disco_in{node=aaeeb4dfb4 src=Udp(172.25.0.11:8173)}: iroh::magicsock: failed to open disco box err=Aead(Error)
fedimintd-1  | 2025-03-25T21:35:08.843054Z  WARN ep{me=aaeeb4dfb4}:magicsock:poll_recv:disco_in{node=aaeeb4dfb4 src=Udp(172.25.0.11:8173)}: iroh::magicsock: failed to open disco box err=Aead(Error)
fedimintd-1  | 2025-03-25T21:35:09.957480Z  WARN ep{me=aaeeb4dfb4}:magicsock:poll_recv:disco_in{node=aaeeb4dfb4 src=Udp(172.25.0.11:8173)}: iroh::magicsock: failed to open disco box err=Aead(Error)
fedimintd-1  | 2025-03-25T21:35:10.386229Z  WARN ep{me=aaeeb4dfb4}:magicsock:poll_recv:disco_in{node=dd48b3eab2 src=Udp(138.199.155.159:8173)}: iroh::magicsock: failed to open disco box err=Aead(Error)
fedimintd-1  | 2025-03-25T21:35:10.674983Z  WARN ep{me=aaeeb4dfb4}:magicsock:poll_recv:disco_in{node=dd48b3eab2 src=Udp(138.199.155.159:8173)}: iroh::magicsock: failed to open disco box err=Aead(Error)
fedimintd-1  | 2025-03-25T21:35:10.889513Z  WARN ep{me=02b251fed0}:magicsock:poll_recv:disco_in{node=c8af7c74f1 src=Udp(172.25.0.11:40494)}: iroh::magicsock: failed to open disco box err=Aead(Error)
fedimintd-1  | 2025-03-25T21:35:11.689323Z  WARN ep{me=02b251fed0}:magicsock:poll_recv:disco_in{node=c8af7c74f1 src=Udp(172.25.0.11:40494)}: iroh::magicsock: failed to open disco box err=Aead(Error)
fedimintd-1  | 2025-03-25T21:35:11.725113Z  WARN ep{me=02b251fed0}:magicsock:poll_recv:disco_in{node=cd3f24e40f src=Udp(172.25.0.11:58893)}: iroh::magicsock: failed to open disco box err=Aead(Error)
fedimintd-1  | 2025-03-25T21:35:11.747939Z  WARN ep{me=02b251fed0}:magicsock:poll_recv:disco_in{node=60e5463231 src=Udp(172.25.0.11:39585)}: iroh::magicsock: failed to open disco box err=Aead(Error)
fedimintd-1  | 2025-03-25T21:35:14.901243Z  WARN ep{me=aaeeb4dfb4}:magicsock:poll_recv:disco_in{node=aaeeb4dfb4 src=Udp(172.25.0.11:8173)}: iroh::magicsock: failed to open disco box err=Aead(Error)
fedimintd-1  | 2025-03-25T21:35:15.889760Z  WARN ep{me=02b251fed0}:magicsock:poll_recv:disco_in{node=c8af7c74f1 src=Udp(172.25.0.11:40494)}: iroh::magicsock: failed to open disco box err=Aead(Error)
fedimintd-1  | 2025-03-25T21:35:16.010419Z  WARN ep{me=02b251fed0}:magicsock:poll_recv:disco_in{node=cd3f24e40f src=Udp(172.25.0.11:58893)}: iroh::magicsock: failed to open disco box err=Aead(Error)
fedimintd-1  | 2025-03-25T21:35:16.689900Z  WARN ep{me=02b251fed0}:magicsock:poll_recv:disco_in{node=c8af7c74f1 src=Udp(172.25.0.11:40494)}: iroh::magicsock: failed to open disco box err=Aead(Error)
fedimintd-1  | 2025-03-25T21:35:16.743261Z  WARN ep{me=02b251fed0}:magicsock:poll_recv:disco_in{node=60e5463231 src=Udp(172.25.0.11:39585)}: iroh::magicsock: failed to open disco box err=Aead(Error)
fedimintd-1  | 2025-03-25T21:35:16.767988Z  WARN ep{me=02b251fed0}:magicsock:poll_recv:disco_in{node=cd3f24e40f src=Udp(172.25.0.11:58893)}: iroh::magicsock: failed to open disco box err=Aead(Error)
fedimintd-1  | 2025-03-25T21:35:18.843060Z  WARN ep{me=aaeeb4dfb4}:magicsock:poll_recv:disco_in{node=aaeeb4dfb4 src=Udp(172.25.0.11:8173)}: iroh::magicsock: failed to open disco box err=Aead(Error)
```

`aaeeb4dfb4` looks like it's own ID. But the other ones don't match any of the hosts.

The source IP `172.25.0.11` is the docker internal IP address of the container. The port `8173` matches when the node id matches our own. So ... like traffic from ourselves? I thought this is rejected.

The other warnings basically use random ports. No idea if this is some docker networking bridge interface artefact or what exactly.

```
ep{me=aaeeb4dfb4}:magicsock:poll_recv:disco_in{node=dd48b3eab2 src=Udp(138.199.155.159:8173)}: iroh::magicsock: failed to open disco box err=Aead(Error)
```

this one matches the IP, port and ID of `docker-1` host, so also 👍 , but why does it error out?

**Comment by dpc** [comment]
Hmmm... maybe UDP packet getting truncated sometimes?

**Comment by dpc** [comment]
OK, so `tcpdump` time . I'm running `sudo nix run nixpkgs#tcpdump -- -n -i br-9a1ce07b13c1` and I think I was able to match the warning with the tcpdump log:


```
fedimintd-1  | 2025-03-25T21:52:42.085906Z  WARN ep{me=7c65ca85de}:magicsock:poll_recv:disco_in{node=56c43b064f src=Udp(172.25.0.11:57103)}: iroh::magicsock: failed to open disco box err=Aead(Error)
```

```
14:52:41.038629 IP 172.25.0.11.57103 > 76.176.65.163.1124: UDP, length 30
```


```
14:52:41.217119 IP 172.25.0.11.57103 > 138.199.155.159.8174: UDP, length 124
14:52:41.217190 IP 172.25.0.11.57103 > 138.199.155.172.8174: UDP, length 124
```

```
14:52:41.409651 IP 138.199.155.159.8174 > 172.25.0.11.57103: UDP, length 111
14:52:41.409656 IP 138.199.155.172.8174 > 172.25.0.11.57103: UDP, length 111
```


Another one:

```
fedimintd-1  | 2025-03-25T21:52:42.038033Z  WARN ep{me=7c65ca85de}:magicsock:poll_recv:disco_in{node=b509f63ec7 src=Udp(172.25.0.11:45833)}: iroh::magicsock: failed to open disco box err=Aead(Error)
```



```
14:52:41.357709 IP 172.25.0.11.45833 > 138.199.155.172.8174: UDP, length 33
...
14:52:41.527334 IP 138.199.155.172.8174 > 172.25.0.11.45833: UDP, length 33
...
14:52:41.700928 IP 172.25.0.11.45833 > 138.199.155.159.8174: UDP, length 30
14:52:41.704488 IP 138.199.155.159.8174 > 172.25.0.11.45833: UDP, length 30
...
14:52:41.726758 IP 172.25.0.11.45833 > 76.176.65.163.1124: UDP, length 30
...
14:52:41.731323 IP 172.25.0.11.45833 > 138.199.155.159.8174: UDP, length 33
```

I did couple of more and nothing really stands out.

**Comment by dpc** [comment]
>  Looking at how you bind the 4 nodes they are all bound on exactly the same ports.


The exact dockerfile is and service in it: https://github.com/fedimint/fedimint/blob/8ccf1aff159e855c62b429dc21271f72935bbb14/docker/deploy-fedimintd/docker-compose.yaml#L46 . These are exact copies using same settings, working in a distributed consensus settings, bound to the same exact port that we want to make sure is opened etc. to maximize chances for direct connections.

>  if they all think their local address is identical then they could be trying to tell each other to try and contact themselves to reach the other - if that makes sense.

It makes a lot of sense and I think this might be exactly what is happening.

**Comment by flub** [comment]
It's been a long while since I seriously used docker, so I don't know all the networking intricacies anymore.

```
networks:
  fedimint_network:
    driver: bridge
    ipam:
      config:
        - subnet: 172.20.0.0/16
          gateway: 172.20.0.1
```
This bit I find interesting though.  I read this as every docker container gets it's own private `172.20.0.0` which is each effectively NATed together via the gateway.  Assuming the DHCP server on those networks is deterministic every container probably gets the same 172.20.0.x IP address.  So then a next question is whether that docker gateway supports "hairpinning".  This is visible in debug logs gain, grep for "hairpinning", or also in the `iroh-doctor report`.

Also, if you could grep the logs for `call-me-maybe` we can also confirm what IP addresses they are sending to each other.

If all if this is on the right track then we should still improve how these packets are detected and handle this more gracefully.

**Comment by dpc** [comment]
> This bit I find interesting though.

To clarify: This bit of configuration just pins the network assigned to the group of containers to the same value. Normally docker seems to be assigning ip ranges 172.X.0.0/16 as available, starting somewhere near 172.16.0.0/16 going up, I think.

> Assuming the DHCP server on those networks is deterministic every container probably gets the same 172.20.0.x IP

The IP to the  container running iroh-enabled-application is assigned statically. Withing that network every container gets a separate IP, but we are running the same exact docker-compose setup on 4 different machines, and each of them will have exactly same private IPs assigned.

> Also, if you could grep the logs

I will try to find some time to debug more next week.
